{
  "$schema": "../schemas/review-comment-issue-ledger.schema.json",
  "identity": {
    "informationUuidV5": "9f2144cf-45ca-505b-a353-105910379a23",
    "observationUuidV7": "01a04cfc-2b4f-718a-83a2-c74468300f07"
  },
  "observedAt": "2026-08-29T10:06:29.711Z",
  "observedAtEpochMs": 1787997989711,
  "stateTransition": "REVIEW_THREADS_UNRESOLVED -> ISSUES_TRACKED -> FIX_IN_PROGRESS",
  "sourceMainCommit": "b61cba217838fce4ef16c0a3403f45afee345352",
  "repository": "Anionix/verifiable-offline-webmcp-agent-spec",
  "summary": {
    "unresolvedReviewThreadsObserved": 53,
    "currentThreadsObserved": 44,
    "outdatedThreadsObserved": 9,
    "issuesAlreadyTracked": 12,
    "issuesCreatedInBatch": 41,
    "fixesVerifiedBeforeBatch": 44,
    "fixesInBatch": 9,
    "actualNotifications": 0,
    "externalBookingEffects": 0,
    "devpostFinalSubmissions": 0
  },
  "entries": [
    {
      "informationUuidV5": "8eaae828-350e-5d0c-9230-ab7239c6ff9c",
      "issueObservationUuidV7": "01a04cf9-d1e5-7228-adf1-73c0ae614143",
      "sourcePullRequest": 23,
      "sourcePullRequestState": "MERGED",
      "sourceMergedAt": "2026-08-28T13:40:58Z",
      "sourceThreadId": "PRRT_kwDOUHFlWs6dL5qq",
      "sourceCommentId": 3881069522,
      "sourceReviewUrl": "https://github.com/Anionix/verifiable-offline-webmcp-agent-spec/pull/23#discussion_r3881069522",
      "path": "scripts/validate_repo.py",
      "line": 150,
      "severity": "P1",
      "title": "実通知の全監査イベントを対象Intentへ結び付ける",
      "outdatedAtObservation": false,
      "threadStateAtObservation": "UNRESOLVED",
      "issueNumber": 114,
      "issueUrl": "https://github.com/Anionix/verifiable-offline-webmcp-agent-spec/issues/114",
      "issueStateAtObservation": "OPEN",
      "issueStateReasonAtObservation": null,
      "trackingDisposition": "ISSUE_CREATED_IN_BATCH",
      "fixDisposition": "FIXED_BEFORE_BATCH"
    },
    {
      "informationUuidV5": "582c16cc-3508-50fb-8d03-fda185f0cc31",
      "issueObservationUuidV7": "01a04cf9-d1e5-7183-856b-458ba1c92be7",
      "sourcePullRequest": 25,
      "sourcePullRequestState": "MERGED",
      "sourceMergedAt": "2026-08-28T14:35:56Z",
      "sourceThreadId": "PRRT_kwDOUHFlWs6dM44v",
      "sourceCommentId": 3881453910,
      "sourceReviewUrl": "https://github.com/Anionix/verifiable-offline-webmcp-agent-spec/pull/25#discussion_r3881453910",
      "path": "MANIFEST.sha256",
      "line": 2,
      "severity": "P1",
      "title": "追跡外のImpeccableキャッシュを整合性生成物から除外する",
      "outdatedAtObservation": false,
      "threadStateAtObservation": "UNRESOLVED",
      "issueNumber": 115,
      "issueUrl": "https://github.com/Anionix/verifiable-offline-webmcp-agent-spec/issues/115",
      "issueStateAtObservation": "OPEN",
      "issueStateReasonAtObservation": null,
      "trackingDisposition": "ISSUE_CREATED_IN_BATCH",
      "fixDisposition": "FIXED_BEFORE_BATCH"
    },
    {
      "informationUuidV5": "1a0d3251-9d1e-5cf5-b7c1-3730c225a55e",
      "issueObservationUuidV7": "01a04cf9-d1e5-70f5-9497-481da250bbb8",
      "sourcePullRequest": 25,
      "sourcePullRequestState": "MERGED",
      "sourceMergedAt": "2026-08-28T14:35:56Z",
      "sourceThreadId": "PRRT_kwDOUHFlWs6dM442",
      "sourceCommentId": 3881453919,
      "sourceReviewUrl": "https://github.com/Anionix/verifiable-offline-webmcp-agent-spec/pull/25#discussion_r3881453919",
      "path": "examples/notification-demo/app.js",
      "line": 145,
      "severity": "P2",
      "title": "再表示時に永続Intent状態と実測効果数を復元する",
      "outdatedAtObservation": false,
      "threadStateAtObservation": "UNRESOLVED",
      "issueNumber": 121,
      "issueUrl": "https://github.com/Anionix/verifiable-offline-webmcp-agent-spec/issues/121",
      "issueStateAtObservation": "OPEN",
      "issueStateReasonAtObservation": null,
      "trackingDisposition": "ISSUE_CREATED_IN_BATCH",
      "fixDisposition": "FIXED_BEFORE_BATCH"
    },
    {
      "informationUuidV5": "8794ae83-d0d5-553a-a48c-0ca34cddc860",
      "issueObservationUuidV7": "01a04cf9-d1e5-7183-8f41-077546199ba0",
      "sourcePullRequest": 29,
      "sourcePullRequestState": "MERGED",
      "sourceMergedAt": "2026-08-28T15:14:06Z",
      "sourceThreadId": "PRRT_kwDOUHFlWs6dNopS",
      "sourceCommentId": 3881745433,
      "sourceReviewUrl": "https://github.com/Anionix/verifiable-offline-webmcp-agent-spec/pull/29#discussion_r3881745433",
      "path": "src/typescript/notification/input-projection.js",
      "line": 104,
      "severity": "P2",
      "title": "入力投影とEngineでUnicode文字数の単位を一致させる",
      "outdatedAtObservation": false,
      "threadStateAtObservation": "UNRESOLVED",
      "issueNumber": 116,
      "issueUrl": "https://github.com/Anionix/verifiable-offline-webmcp-agent-spec/issues/116",
      "issueStateAtObservation": "OPEN",
      "issueStateReasonAtObservation": null,
      "trackingDisposition": "ISSUE_CREATED_IN_BATCH",
      "fixDisposition": "FIXED_BEFORE_BATCH"
    },
    {
      "informationUuidV5": "d0cbd2d7-4641-5341-8ecd-6c3ec70ecb50",
      "issueObservationUuidV7": "01a04cf9-d1e5-7457-acab-f8de0c92c69d",
      "sourcePullRequest": 31,
      "sourcePullRequestState": "MERGED",
      "sourceMergedAt": "2026-08-28T15:52:40Z",
      "sourceThreadId": "PRRT_kwDOUHFlWs6dOTPg",
      "sourceCommentId": 3882005648,
      "sourceReviewUrl": "https://github.com/Anionix/verifiable-offline-webmcp-agent-spec/pull/31#discussion_r3882005648",
      "path": "MANIFEST.sha256",
      "line": 33,
      "severity": "P1",
      "title": "追跡外のPlaywright生成物を整合性生成物から除外する",
      "outdatedAtObservation": false,
      "threadStateAtObservation": "UNRESOLVED",
      "issueNumber": 119,
      "issueUrl": "https://github.com/Anionix/verifiable-offline-webmcp-agent-spec/issues/119",
      "issueStateAtObservation": "OPEN",
      "issueStateReasonAtObservation": null,
      "trackingDisposition": "ISSUE_CREATED_IN_BATCH",
      "fixDisposition": "FIXED_BEFORE_BATCH"
    },
    {
      "informationUuidV5": "5eb768bd-d625-54bd-ac1e-7344f214c629",
      "issueObservationUuidV7": "01a04cf9-d1e5-720b-a7c3-f2ad964a8b48",
      "sourcePullRequest": 36,
      "sourcePullRequestState": "MERGED",
      "sourceMergedAt": "2026-08-28T16:31:21Z",
      "sourceThreadId": "PRRT_kwDOUHFlWs6dPBZp",
      "sourceCommentId": 3882287954,
      "sourceReviewUrl": "https://github.com/Anionix/verifiable-offline-webmcp-agent-spec/pull/36#discussion_r3882287954",
      "path": "scripts/validate_repo.py",
      "line": 445,
      "severity": "P1",
      "title": "取込操作を署名済み元イベントへ結び付ける",
      "outdatedAtObservation": false,
      "threadStateAtObservation": "UNRESOLVED",
      "issueNumber": 118,
      "issueUrl": "https://github.com/Anionix/verifiable-offline-webmcp-agent-spec/issues/118",
      "issueStateAtObservation": "OPEN",
      "issueStateReasonAtObservation": null,
      "trackingDisposition": "ISSUE_CREATED_IN_BATCH",
      "fixDisposition": "FIXED_BEFORE_BATCH"
    },
    {
      "informationUuidV5": "7de0ffb0-07d0-57d5-ab26-18a0fc3bb5fa",
      "issueObservationUuidV7": "01a04cf9-d1e5-711a-bdc7-beee4aa27c5a",
      "sourcePullRequest": 41,
      "sourcePullRequestState": "MERGED",
      "sourceMergedAt": "2026-08-28T17:06:48Z",
      "sourceThreadId": "PRRT_kwDOUHFlWs6dPntE",
      "sourceCommentId": 3882524151,
      "sourceReviewUrl": "https://github.com/Anionix/verifiable-offline-webmcp-agent-spec/pull/41#discussion_r3882524151",
      "path": "src/typescript/planner/responses-adapter.ts",
      "line": 164,
      "severity": "P2",
      "title": "不正なfunction_callを捨てず応答全体を停止する",
      "outdatedAtObservation": false,
      "threadStateAtObservation": "UNRESOLVED",
      "issueNumber": 117,
      "issueUrl": "https://github.com/Anionix/verifiable-offline-webmcp-agent-spec/issues/117",
      "issueStateAtObservation": "OPEN",
      "issueStateReasonAtObservation": null,
      "trackingDisposition": "ISSUE_CREATED_IN_BATCH",
      "fixDisposition": "FIXED_BEFORE_BATCH"
    },
    {
      "informationUuidV5": "50c742e0-9680-5e81-aba8-10d16e668220",
      "issueObservationUuidV7": "01a04cf9-d1e5-76d4-9a82-85d9466aa55d",
      "sourcePullRequest": 41,
      "sourcePullRequestState": "MERGED",
      "sourceMergedAt": "2026-08-28T17:06:48Z",
      "sourceThreadId": "PRRT_kwDOUHFlWs6dPntK",
      "sourceCommentId": 3882524159,
      "sourceReviewUrl": "https://github.com/Anionix/verifiable-offline-webmcp-agent-spec/pull/41#discussion_r3882524159",
      "path": "src/typescript/planner/policy.ts",
      "line": 149,
      "severity": "P2",
      "title": "直列化済みPlanner入力の4096文字上限を守る",
      "outdatedAtObservation": false,
      "threadStateAtObservation": "UNRESOLVED",
      "issueNumber": 120,
      "issueUrl": "https://github.com/Anionix/verifiable-offline-webmcp-agent-spec/issues/120",
      "issueStateAtObservation": "OPEN",
      "issueStateReasonAtObservation": null,
      "trackingDisposition": "ISSUE_CREATED_IN_BATCH",
      "fixDisposition": "FIXED_BEFORE_BATCH"
    },
    {
      "informationUuidV5": "bb100684-f2fc-50a3-ad9b-4be3516a9a10",
      "issueObservationUuidV7": "01a04cf9-d1e5-7070-904b-40434513b6e8",
      "sourcePullRequest": 41,
      "sourcePullRequestState": "MERGED",
      "sourceMergedAt": "2026-08-28T17:06:48Z",
      "sourceThreadId": "PRRT_kwDOUHFlWs6dPntQ",
      "sourceCommentId": 3882524168,
      "sourceReviewUrl": "https://github.com/Anionix/verifiable-offline-webmcp-agent-spec/pull/41#discussion_r3882524168",
      "path": "schemas/responses-planner-request.schema.json",
      "line": 49,
      "severity": "P2",
      "title": "入れ子の道具引数Schemaを再帰的に閉じる",
      "outdatedAtObservation": false,
      "threadStateAtObservation": "UNRESOLVED",
      "issueNumber": 123,
      "issueUrl": "https://github.com/Anionix/verifiable-offline-webmcp-agent-spec/issues/123",
      "issueStateAtObservation": "OPEN",
      "issueStateReasonAtObservation": null,
      "trackingDisposition": "ISSUE_CREATED_IN_BATCH",
      "fixDisposition": "FIXED_BEFORE_BATCH"